{
  "schema_version": 2,
  "run_id": "c80914813bbe",
  "report_type": "DAILY_CLOSED",
  "report_date_utc": "2026-07-29",
  "window_start_utc": "2026-07-29T00:00:00+00:00",
  "window_end_utc": "2026-07-30T00:00:00+00:00",
  "report_cutoff_utc": "2026-07-29T21:17:20.562434+00:00",
  "generated_at_utc": "2026-07-29T21:17:20.562498+00:00",
  "git_commit": null,
  "policy_id": "H3BUP_vNext",
  "policy_version": "H3BUP_vNext_20260629",
  "policy_fingerprint": null,
  "source_manifest": {
    "executor_live": {
      "path": "/home/betbot/Bets/betinasia_bot/logs/executor_live.jsonl",
      "exists": true,
      "mtime_utc": "2026-07-29T21:16:23.002305+00:00",
      "size": 72538117,
      "sha256_prefix": "33ed288e744855ac",
      "source_cutoff_utc": "2026-07-29T21:16:23.002305+00:00",
      "age_seconds": 57.560129,
      "status": "HEALTHY"
    },
    "accounting_health": {
      "path": "/home/betbot/Bets/betinasia_bot/logs/accounting/accounting_health.json",
      "exists": true,
      "mtime_utc": "2026-07-29T21:12:30.838815+00:00",
      "size": 1002,
      "sha256_prefix": "137159fa66d1fdf6",
      "source_cutoff_utc": "2026-07-29T21:12:30.838815+00:00",
      "health_json_status": "ACCOUNTING_OK",
      "age_seconds": 289.723619,
      "status": "HEALTHY"
    },
    "accounting_daily_report": {
      "path": "/home/betbot/Bets/betinasia_bot/logs/accounting_daily_report.json",
      "exists": true,
      "mtime_utc": "2026-07-28T22:02:42.108069+00:00",
      "size": 1576,
      "sha256_prefix": "a44f909b01d47e00",
      "source_cutoff_utc": "2026-07-28T22:02:42.108069+00:00",
      "age_seconds": 83678.454365,
      "status": "WATCH"
    },
    "e2e_trace": {
      "path": "/home/betbot/Bets/betinasia_bot/logs/h3bup_e2e_trace.jsonl",
      "exists": true,
      "mtime_utc": "2026-07-29T21:16:52.228003+00:00",
      "size": 7740102,
      "sha256_prefix": "96ad79b4dff84e99",
      "source_cutoff_utc": "2026-07-29T21:16:52.228003+00:00",
      "age_seconds": 28.334431,
      "status": "HEALTHY"
    },
    "clv_health": {
      "path": "/home/betbot/Bets/betinasia_bot/logs/h3bup_clv_health.json",
      "exists": true,
      "mtime_utc": "2026-07-29T21:17:17.370322+00:00",
      "size": 1024,
      "sha256_prefix": "a129e7dfc99f4ca8",
      "source_cutoff_utc": "2026-07-29T21:17:17.370322+00:00",
      "health_json_status": "WATCH",
      "age_seconds": 3.192112,
      "status": "WATCH"
    },
    "clv_obligations": {
      "path": "/home/betbot/Bets/betinasia_bot/logs/h3bup_clv_obligations.jsonl",
      "exists": true,
      "mtime_utc": "2026-07-29T20:54:03.279857+00:00",
      "size": 26246,
      "sha256_prefix": "cc92b9b0a4d0a66a",
      "source_cutoff_utc": "2026-07-29T20:54:03.279857+00:00",
      "age_seconds": 1397.282577,
      "status": "HEALTHY"
    },
    "policy_current": {
      "path": "/home/betbot/Bets/betinasia_bot/logs/wf_policy_current.json",
      "exists": true,
      "mtime_utc": "2026-06-29T13:15:03.295096+00:00",
      "size": 9770,
      "sha256_prefix": "8009c8fa4b67b75f",
      "source_cutoff_utc": "2026-06-29T13:15:03.295096+00:00",
      "age_seconds": 2620937.267338,
      "status": "STALE"
    },
    "risk_params": {
      "path": "/home/betbot/Bets/betinasia_bot/logs/bridge_risk_params.json",
      "exists": true,
      "mtime_utc": "2026-07-20T15:16:08.267440+00:00",
      "size": 580,
      "sha256_prefix": "6a38c6ddd893a215",
      "source_cutoff_utc": "2026-07-20T15:16:08.267440+00:00",
      "age_seconds": 799272.294994,
      "status": "STALE"
    },
    "accounting_balance": {
      "path": "/home/betbot/Bets/betinasia_bot/logs/accounting/20260729_211223__balance.csv",
      "exists": true,
      "mtime_utc": "2026-07-29T21:12:23.724155+00:00",
      "size": 2981343,
      "sha256_prefix": "72828baa1ea7a980",
      "source_cutoff_utc": "2026-07-29T21:12:23.724155+00:00",
      "age_seconds": 296.838279,
      "status": "HEALTHY"
    },
    "accounting_open_stakes": {
      "path": "/home/betbot/Bets/betinasia_bot/logs/accounting/20260729_211230__open_stakes.csv",
      "exists": true,
      "mtime_utc": "2026-07-29T21:12:30.786811+00:00",
      "size": 33224,
      "sha256_prefix": "aff5fbc014b4e748",
      "source_cutoff_utc": "2026-07-29T21:12:30.786811+00:00",
      "age_seconds": 289.775623,
      "status": "HEALTHY"
    }
  },
  "report_health": {
    "status": "HEALTHY",
    "notes": [
      "REPORT_HEALTH distinct from STRATEGY_OPERATIONS_HEALTH"
    ]
  },
  "operations_health": {
    "status": "WATCH",
    "notes": [
      "derived from services externally; Daily V2 does not restart services"
    ]
  },
  "data_quality": {
    "accounting": "HEALTHY",
    "e2e": "HEALTHY",
    "clv": "WATCH"
  },
  "statistical_readiness": {
    "roi": "PARTIAL",
    "clv": "INSUFFICIENT_N",
    "e2e": "AVAILABLE"
  },
  "execution_funnel": {
    "live_ok": {
      "value": 22,
      "unit": "count",
      "n": 22,
      "numerator": null,
      "denominator": null,
      "coverage_pct": null,
      "status": "AVAILABLE",
      "metric_version": "v2.0",
      "source": "executor_live.jsonl",
      "notes": []
    },
    "order_ids": [
      "1934662052",
      "1934994839",
      "1935045057",
      "1935402833",
      "1935460146",
      "1935475500",
      "1935568718",
      "1935642980",
      "1935703108",
      "1936401912",
      "1936596042",
      "1936637320",
      "1936724778",
      "1936750483",
      "1936946893",
      "1936956073",
      "1936961828",
      "1936963700",
      "1937013393",
      "1937095091",
      "1937669560",
      "1937747430"
    ],
    "fast_buckets": {
      "DAILY_FAST_LE_6S": {
        "n": 22,
        "threshold_ms": 6000,
        "op": "<="
      },
      "STUDY_FAST_LT_4S": {
        "n": 21,
        "threshold_ms": 4000,
        "op": "<",
        "label": "exploratory_only"
      },
      "DAILY_SLOW_GT_6S": {
        "n": 0
      },
      "PRE_SUBMIT_MS_NA": {
        "n": 0
      }
    },
    "orders_sample": {
      "1934662052": {
        "order_id": "1934662052",
        "status": "LIVE_OK",
        "created_at": "2026-07-29T04:00:51.513933+00:00",
        "stake": 10.0,
        "pre_submit_ms": 1261,
        "policy_version": "H3BUP_vNext_20260629",
        "exec_side": "back",
        "audit_id": 420839,
        "slippage_pre_pct": -1.9467213114754116,
        "is_h3bup": true
      },
      "1934994839": {
        "order_id": "1934994839",
        "status": "LIVE_OK",
        "created_at": "2026-07-29T07:51:53.000127+00:00",
        "stake": 10.0,
        "pre_submit_ms": 1115,
        "policy_version": "H3BUP_vNext_20260629",
        "exec_side": "back",
        "audit_id": 421000,
        "slippage_pre_pct": -1.3768485466598743,
        "is_h3bup": true
      },
      "1935045057": {
        "order_id": "1935045057",
        "status": "LIVE_OK",
        "created_at": "2026-07-29T08:28:28.900981+00:00",
        "stake": 10.0,
        "pre_submit_ms": 1155,
        "policy_version": "H3BUP_vNext_20260629",
        "exec_side": "back",
        "audit_id": 421030,
        "slippage_pre_pct": -0.39254170755642825,
        "is_h3bup": true
      },
      "1935402833": {
        "order_id": "1935402833",
        "status": "LIVE_OK",
        "created_at": "2026-07-29T10:42:41.730156+00:00",
        "stake": 10.0,
        "pre_submit_ms": 4785,
        "policy_version": "H3BUP_vNext_20260629",
        "exec_side": "back",
        "audit_id": 421392,
        "slippage_pre_pct": -6.189555125725344,
        "is_h3bup": true
      },
      "1935460146": {
        "order_id": "1935460146",
        "status": "LIVE_OK",
        "created_at": "2026-07-29T10:59:25.391071+00:00",
        "stake": 10.0,
        "pre_submit_ms": 1223,
        "policy_version": "H3BUP_vNext_20260629",
        "exec_side": "back",
        "audit_id": 421512,
        "slippage_pre_pct": -1.9221291276490846,
        "is_h3bup": true
      },
      "1935475500": {
        "order_id": "1935475500",
        "status": "LIVE_OK",
        "created_at": "2026-07-29T11:04:26.200252+00:00",
        "stake": 10.0,
        "pre_submit_ms": 1113,
        "policy_version": "H3BUP_vNext_20260629",
        "exec_side": "back",
        "audit_id": 421546,
        "slippage_pre_pct": -3.7526427061310756,
        "is_h3bup": true
      },
      "1935568718": {
        "order_id": "1935568718",
        "status": "LIVE_OK",
        "created_at": "2026-07-29T11:28:10.704022+00:00",
        "stake": 10.0,
        "pre_submit_ms": 2214,
        "policy_version": "H3BUP_vNext_20260629",
        "exec_side": "back",
        "audit_id": 421737,
        "slippage_pre_pct": -3.951975987994006,
        "is_h3bup": true
      },
      "1935642980": {
        "order_id": "1935642980",
        "status": "LIVE_OK",
        "created_at": "2026-07-29T11:49:35.133640+00:00",
        "stake": 10.0,
        "pre_submit_ms": 1679,
        "policy_version": "H3BUP_vNext_20260629",
        "exec_side": "back",
        "audit_id": 421892,
        "slippage_pre_pct": -3.118393234672302,
        "is_h3bup": true
      },
      "1935703108": {
        "order_id": "1935703108",
        "status": "LIVE_OK",
        "created_at": "2026-07-29T12:11:53.027523+00:00",
        "stake": 10.0,
        "pre_submit_ms": 1169,
        "policy_version": "H3BUP_vNext_20260629",
        "exec_side": "back",
        "audit_id": 421992,
        "slippage_pre_pct": -5.4468535166578524,
        "is_h3bup": true
      },
      "1936401912": {
        "order_id": "1936401912",
        "status": "LIVE_OK",
        "created_at": "2026-07-29T15:42:32.181242+00:00",
        "stake": 10.0,
        "pre_submit_ms": 1741,
        "policy_version": "H3BUP_vNext_20260629",
        "exec_side": "back",
        "audit_id": 422603,
        "slippage_pre_pct": -6.771344455348377,
        "is_h3bup": true
      },
      "1936596042": {
        "order_id": "1936596042",
        "status": "LIVE_OK",